{
  "version": 2,
  "contract": "kani-0.66.0-text-v1",
  "kani_version": "0.66.0",
  "target": "x86_64-unknown-linux-gnu",
  "solver": "cadical",
  "budgets": {
    "timeout_seconds": 600,
    "list_timeout_seconds": 1800,
    "memory_limit_bytes": 17179869184
  },
  "toolchain": {
    "rust_toolchain_toml_sha256": "4a5584412b769268fb5419ac4036a17b3df9f8b19fcb80fc69b459f4f1a19d20",
    "note": "Kani's bundled rustc is recorded from rustc -vV at run time"
  },
  "cargo_config": {
    "registered_files": [
      {
        "path": ".cargo/config.toml",
        "sha256": "cc3851598f6f3e7f15bff15508fc23942222f896c176d52749e4f3ca7cb0d44d"
      }
    ]
  },
  "groups": [
    {
      "id": "ffi-evidence",
      "class": "required",
      "gating": "evidence",
      "package": {
        "name": "ffi",
        "manifest": "crates/ffi/Cargo.toml"
      },
      "crate": "ffi",
      "features": [
        "kani"
      ],
      "no_default_features": true,
      "cfg": [
        "kani"
      ],
      "default_unwind": 16,
      "harnesses": [
        {
          "name": "kani_tests::verification::verify_json_member_c_layout",
          "file": "crates/ffi/src/kani_tests.rs",
          "domain": "Rust JsonMemberC size 32 and alignment 8 on x86_64; no C layout equivalence proof.",
          "rows": [
            "7515-007"
          ]
        },
        {
          "name": "kani_tests::verification::verify_utf8_decode_null_safety",
          "file": "crates/ffi/src/kani_tests.rs",
          "domain": "Two fixed null-pointer calls to the production UTF-8 helper.",
          "rows": [
            "7515-007"
          ]
        },
        {
          "name": "kani_tests::verification::verify_free_string_null_safety",
          "file": "crates/ffi/src/kani_tests.rs",
          "domain": "One null-pointer call to the production free helper; no allocated-pointer ownership proof.",
          "rows": [
            "7515-007"
          ]
        },
        {
          "name": "kani_tests::verification::verify_jose_context_bounds",
          "file": "crates/ffi/src/kani_tests.rs",
          "domain": "Default JoseContext header limit is positive and fits i32.",
          "rows": [
            "7515-007"
          ]
        },
        {
          "name": "kani_tests::verification::verify_json_member_c_pointer_validity",
          "file": "crates/ffi/src/kani_tests.rs",
          "domain": "One fixed Rust struct preserves field values and non-null pointers; no arbitrary-pointer validity proof.",
          "rows": [
            "7515-007"
          ]
        },
        {
          "name": "id_token::kani_verification::oidc_id_token_jwt_canonicalisation_no_panic",
          "file": "crates/ffi/src/id_token.rs",
          "domain": "Exactly six fixed compact-JWT strings of at most 11 bytes; production Rust framing only, no signature or native parser verification.",
          "rows": [
            "OIDC-1-007",
            "OIDC-1-010"
          ],
          "unreachable_assertions": {
            "id_token::kani_verification::oidc_id_token_jwt_canonicalisation_no_panic.assertion.2": "unexpected canonicalisation error"
          }
        }
      ]
    },
    {
      "id": "kani-harness-regressions",
      "class": "required",
      "gating": "regression",
      "package": {
        "name": "aegaeon-kani-harness",
        "manifest": "crates/kani-harness/Cargo.toml"
      },
      "crate": "aegaeon_kani_harness",
      "features": [],
      "no_default_features": false,
      "cfg": [
        "kani"
      ],
      "default_unwind": 16,
      "harnesses": [
        {
          "name": "harnesses::proof_trivial_arithmetic",
          "file": "crates/kani-harness/src/lib.rs",
          "domain": "toolchain smoke (1+1==2); no production domain"
        },
        {
          "name": "harnesses::proof_parse_cache_control_no_panic",
          "file": "crates/kani-harness/src/lib.rs",
          "domain": "cfg(kani) table model parse_cache_control_case over 4 enumerated cases; no production parser",
          "unwind": 16
        },
        {
          "name": "harnesses::proof_nix_integration_check",
          "file": "crates/kani-harness/src/lib.rs",
          "domain": "toolchain smoke (any u8 <10, array index); no production domain"
        },
        {
          "name": "harnesses::proof_level0_primitives_only",
          "file": "crates/kani-harness/src/lib.rs",
          "domain": "toolchain ICE regression (constants); no production domain"
        },
        {
          "name": "harnesses::proof_bytestring_minimal_inline",
          "file": "crates/kani-harness/src/lib.rs",
          "domain": "toolchain ICE regression (inline [u8;64] struct); no production domain"
        },
        {
          "name": "harnesses::proof_level6_bytestring_store",
          "file": "crates/kani-harness/src/lib.rs",
          "domain": "toolchain ICE regression (bounded_stores::ByteString store); model type only",
          "unwind": 5
        },
        {
          "name": "harnesses::proof_string_new_minimal",
          "file": "crates/kani-harness/src/lib.rs",
          "domain": "toolchain regression (String::new); no production domain"
        },
        {
          "name": "harnesses::proof_string_from_minimal",
          "file": "crates/kani-harness/src/lib.rs",
          "domain": "toolchain regression (String::from); no production domain"
        },
        {
          "name": "harnesses::proof_option_string_minimal",
          "file": "crates/kani-harness/src/lib.rs",
          "domain": "toolchain regression (Option<String>); no production domain"
        },
        {
          "name": "upstream_deadline::epoch_fraction_full_domain",
          "file": "crates/kani-harness/src/upstream_deadline.rs",
          "domain": "Actual production epoch_duration, every u64 second and u32 fraction including invalid fractions; exact representation or rejection. No assumptions or stubs."
        },
        {
          "name": "upstream_deadline::epoch_reconstruction_linux",
          "file": "crates/kani-harness/src/upstream_deadline.rs",
          "domain": "Actual production checked SystemTime reconstruction, every u64 second and u32 fraction; invalid fractions and Linux i64 second overflow rejected, canonical accepted values exact. Pinned x86_64 Linux std implementation; other OS representations external."
        },
        {
          "name": "upstream_deadline::positive_ttl_ceiling_full_domain",
          "file": "crates/kani-harness/src/upstream_deadline.rs",
          "domain": "Actual production positive_ttl_millis, every u64 second and canonical u32 nanosecond (less than 1e9). Independent u128 seconds*1000 plus numerator-ceiling oracle; auxiliary fraction_ceiling_is_minimal establishes minimal non-early rounding. Exact zero and u64 millisecond overflow rejection; no stubs."
        },
        {
          "name": "upstream_deadline::strict_deadline_linux",
          "file": "crates/kani-harness/src/upstream_deadline.rs",
          "domain": "Actual production redis_ttl_millis_at and unmodified std SystemTime, all i64 seconds and canonical nanoseconds for both times. Independent i128 signed-seconds/borrow and fraction-ceiling oracle proves strict expiry, exact ceiling, overflow. Pinned x86_64 Linux representation; real clocks, serde, Redis/Lua behavior, atomicity and constant time are external."
        },
        {
          "name": "upstream_deadline::fraction_ceiling_is_minimal",
          "file": "crates/kani-harness/src/upstream_deadline.rs",
          "domain": "Auxiliary oracle lemma, every canonical u32 nanosecond fraction: numerator-based ceiling is the minimal integer milliseconds covering the fraction, zero iff zero. Composed by ordinary arithmetic with an integer seconds*1000 term in the production TTL and strict-deadline harnesses; not independently a production claim."
        },
        {
          "name": "upstream_issuer::policy_version_full_domain",
          "file": "crates/kani-harness/src/upstream_issuer.rs",
          "domain": "Production version admission across every u32; serde missing/type rejection and Redis atomicity excluded.",
          "rows": [
            "9207-001"
          ]
        },
        {
          "name": "upstream_issuer::frozen_requirement_all_metadata_states",
          "file": "crates/kani-harness/src/upstream_issuer.rs",
          "domain": "Production freeze across every boolean profile and all three discovery Option<bool> values; trusted discovery excluded.",
          "rows": [
            "9207-001"
          ]
        },
        {
          "name": "upstream_issuer::exact_issuer_bytes_bounded",
          "file": "crates/kani-harness/src/upstream_issuer.rs",
          "domain": "Production byte equality for arbitrary byte arrays with independent lengths 0..=8; no UTF-8, URL parser, network or full-string-domain proof.",
          "rows": [
            "9207-001"
          ]
        },
        {
          "name": "upstream_refresh::freshness_full_numeric_domain",
          "file": "crates/kani-harness/src/upstream_refresh.rs",
          "domain": "Direct production lower-bound freshness predicate over all i64 iat and u64 request-start/leeway values, checked against independent i128 subtraction. Clock accuracy, request timestamp capture, upper-time/expiry checks, signatures, DB concurrency and replay-freedom excluded."
        },
        {
          "name": "bounded_federation_cache::proof_entity_cache_retains_expired_acquisition",
          "file": "crates/kani-harness/src/bounded_federation_cache.rs",
          "domain": "Initialized four-slot/64-byte-identifier non-DB model with one fixed six-byte natural key; all i64 insertion/replacement timestamps with expires_at <= fetched_at. Exact timestamp retention, uniqueness, strict GET refusal at acquisition/expiry and cleanup; no SQL, JWS, clocks or product correspondence.",
          "unwind": 70
        }
      ]
    },
    {